id,ticket_no,user_id,order_no,ticket_type,priority,status,description,created_at,updated_at
1,TK202606040001,2,ORD202606010002,退货,中,处理中,用户反馈耳机佩戴不适，咨询是否支持退货。,2026-06-04 17:20:00,2026-06-04 17:45:00
2,TK202606050001,3,ORD202606020001,物流异常,中,待处理,笔记本订单已支付但长时间未发货，用户要求催发。,2026-06-05 09:15:00,2026-06-05 09:15:00
3,TK202606060001,8,ORD202606040002,退款,高,处理中,扫地机器人已签收，用户反馈无法正常充电，申请退款。,2026-06-06 11:30:00,2026-06-09 11:15:00
4,TK202606060002,5,ORD202606030001,物流异常,低,处理中,机械键盘显示派送中超过24小时未送达，用户要求查询物流。,2026-06-06 14:05:00,2026-06-06 15:00:00
5,TK202606070001,1,ORD202606010001,发票问题,低,已完成,用户需要补开发票并修改发票抬头。,2026-06-07 10:10:00,2026-06-07 16:30:00
6,TK202606080001,9,ORD202606050001,换货,高,待处理,折叠屏手机外包装破损，用户要求换货处理。,2026-06-08 12:40:00,2026-06-08 12:40:00
7,TK202606090001,10,ORD202606050002,投诉,中,已关闭,用户投诉鼠标垫物流延迟，客服已解释并补偿优惠券。,2026-06-09 09:35:00,2026-06-09 18:00:00
8,TK202606100001,6,ORD202606070002,退款,中,待处理,电风扇已签收，用户反馈噪音偏大，咨询退款流程。,2026-06-10 13:25:00,2026-06-10 13:25:00
